<?xml version="1.0" encoding="UTF-8"?>
<!--          THIS DATA SUBJECT TO DISCLAIMER(S) INCLUDED WITH THE PRODUCT OF ORIGIN.           -->
<ccdyn:ConsumableConfigDyn xsi:schemaLocation="http://www.hp.com/schemas/imaging/con/ledm/consumableconfigdyn/2007/11/19 ../schemas/ConsumableConfigDyn.xsd http://www.hp.com/schemas/imaging/con/dictionaries/1.0/ ../schemas/dd/DataDictionaryMasterLEDM.xsd" xmlns:dd="http://www.hp.com/schemas/imaging/con/dictionaries/1.0/" xmlns:dd2="http://www.hp.com/schemas/imaging/con/dictionaries/2008/10/10" xmlns:ccdyn="http://www.hp.com/schemas/imaging/con/ledm/consumableconfigdyn/2007/11/19" xmlns:xsi="http://www.w3.org/2001/XMLSchema-instance">
	<dd:Version>
		<dd:Revision>SVN-IPG-LEDM.290</dd:Revision>
		<dd:Date>2010-06-02</dd:Date>
	</dd:Version>
	<ccdyn:ProductConsumableInfo>
		<dd:NumOfUserReplaceableConsumables>2</dd:NumOfUserReplaceableConsumables>
		<dd:NumOfNonUserReplaceableConsumables>0</dd:NumOfNonUserReplaceableConsumables>
		<dd:AlignmentMode>manual</dd:AlignmentMode>
		<ccdyn:CartridgeChipInfo>disabled</ccdyn:CartridgeChipInfo>
		<dd:ConsumableSlotDirection>leftToRight</dd:ConsumableSlotDirection>
		<dd:IK>712</dd:IK>
		<ccdyn:SingleCartridgeMode>enabled</ccdyn:SingleCartridgeMode>
		<dd:StoreUsageData>disabled</dd:StoreUsageData>
		<dd:AntiTheftMode>disabled</dd:AntiTheftMode>
		<ccdyn:RewardsRegistrationStatus>
			<dd:OptedIn>false</dd:OptedIn>
			<dd:AutoSendData>false</dd:AutoSendData>
			<dd:PromptAutoSendData>false</dd:PromptAutoSendData>
		</ccdyn:RewardsRegistrationStatus>
	</ccdyn:ProductConsumableInfo>
	<ccdyn:ConsumableInfo>
		<dd:Capacity>
			<dd:MaxCapacity>0</dd:MaxCapacity>
			<dd:Unit>tenthsOfMilliliters</dd:Unit>
		</dd:Capacity>
		<ccdyn:ConsumableSubBrand>generic</ccdyn:ConsumableSubBrand>
		<ccdyn:ConsumableSegmentClass>class3</ccdyn:ConsumableSegmentClass>
		<dd:ConsumableAcceptibilityUpgradability>notSupported</dd:ConsumableAcceptibilityUpgradability>
		<dd:ConsumableContentType>markingAgent</dd:ConsumableContentType>
		<dd:ConsumableFamilyName>TIJ2</dd:ConsumableFamilyName>
		<dd2:ConsumableID>0000000000000000000000000000000000000000000000000000000000000000C02A5C00000001DC50368CA4C73A913701A6060000007C1B9F070238004C3CC7</dd2:ConsumableID>
		<dd:ConsumableKeyingDescriptor>large3</dd:ConsumableKeyingDescriptor>
		<dd:ConsumableLabelCode>CMY</dd:ConsumableLabelCode>
		<dd:ConsumableLifeState>
			<dd:ConsumableState>newGenuineHP</dd:ConsumableState>
			<dd:MeasuredQuantityState>ok</dd:MeasuredQuantityState>
			<dd:Brand>HP</dd:Brand>
			<dd:IsRefilled>false</dd:IsRefilled>
			<dd:IsSETUP>false</dd:IsSETUP>
			<dd:IsTrial>false</dd:IsTrial>
		</dd:ConsumableLifeState>
		<dd:ConsumableStateAvailableActions>
			<dd:ConsumableState>newGenuineHP</dd:ConsumableState>
			<dd:SupportedActions>
				<dd:ConsumableStateAction>acknowledge</dd:ConsumableStateAction>
				<dd:ConsumableStateAction>none</dd:ConsumableStateAction>
			</dd:SupportedActions>
			<dd:DefaultAction>acknowledge</dd:DefaultAction>
		</dd:ConsumableStateAvailableActions>
		<dd:ConsumableLevelMessagingStyle>Eureka</dd:ConsumableLevelMessagingStyle>
		<ccdyn:ConsumableLowUseAlgorithm>everyday3</ccdyn:ConsumableLowUseAlgorithm>
		<dd:ConsumablePercentageLevelRemaining>90</dd:ConsumablePercentageLevelRemaining>
		<dd:ConsumableReplaceabilityType>userReplaceable</dd:ConsumableReplaceabilityType>
		<dd:ConsumableStation>0</dd:ConsumableStation>
		<dd:ConsumableTypeEnum>inkCartridge</dd:ConsumableTypeEnum>
		<dd:RegionalCartridge>
			<dd:RegionIdentifier>21</dd:RegionIdentifier>
		</dd:RegionalCartridge>
		<dd:ConsumableIcon>
			<dd:Shape>CMYTriDots</dd:Shape>
			<dd:Rotation>rotateZero</dd:Rotation>
			<dd:FillColor>
				<dd:Red>255</dd:Red>
				<dd:Green>255</dd:Green>
				<dd:Blue>255</dd:Blue>
			</dd:FillColor>
			<dd:OutlineColor>
				<dd:Red>255</dd:Red>
				<dd:Green>255</dd:Green>
				<dd:Blue>255</dd:Blue>
			</dd:OutlineColor>
			<dd:BackGroundColor>
				<dd:Red>255</dd:Red>
				<dd:Green>255</dd:Green>
				<dd:Blue>255</dd:Blue>
			</dd:BackGroundColor>
		</dd:ConsumableIcon>
		<ccdyn:ConsumableUniqueID>00000000000000ee281b46a4c73a9137</ccdyn:ConsumableUniqueID>
	</ccdyn:ConsumableInfo>
	<ccdyn:ConsumableInfo>
		<dd:Capacity>
			<dd:MaxCapacity>0</dd:MaxCapacity>
			<dd:Unit>tenthsOfMilliliters</dd:Unit>
		</dd:Capacity>
		<ccdyn:ConsumableSubBrand>generic</ccdyn:ConsumableSubBrand>
		<ccdyn:ConsumableSegmentClass>class3</ccdyn:ConsumableSegmentClass>
		<dd:ConsumableAcceptibilityUpgradability>notSupported</dd:ConsumableAcceptibilityUpgradability>
		<dd:ConsumableContentType>markingAgent</dd:ConsumableContentType>
		<dd:ConsumableFamilyName>TIJ2</dd:ConsumableFamilyName>
		<dd2:ConsumableID>00000000000000000000000000000000000000000000000000000000000000004106000E000025616939E9782D39916E000EA0019DF285000014A00000344FC9</dd2:ConsumableID>
		<dd:ConsumableKeyingDescriptor>large3</dd:ConsumableKeyingDescriptor>
		<dd:ConsumableLabelCode>K</dd:ConsumableLabelCode>
		<dd:ConsumableLifeState>
			<dd:ConsumableState>newGenuineHP</dd:ConsumableState>
			<dd:MeasuredQuantityState>ok</dd:MeasuredQuantityState>
			<dd:Brand>HP</dd:Brand>
			<dd:IsRefilled>false</dd:IsRefilled>
			<dd:IsSETUP>false</dd:IsSETUP>
			<dd:IsTrial>false</dd:IsTrial>
		</dd:ConsumableLifeState>
		<dd:ConsumableStateAvailableActions>
			<dd:ConsumableState>newGenuineHP</dd:ConsumableState>
			<dd:SupportedActions>
				<dd:ConsumableStateAction>acknowledge</dd:ConsumableStateAction>
				<dd:ConsumableStateAction>none</dd:ConsumableStateAction>
			</dd:SupportedActions>
			<dd:DefaultAction>acknowledge</dd:DefaultAction>
		</dd:ConsumableStateAvailableActions>
		<dd:ConsumableLevelMessagingStyle>Eureka</dd:ConsumableLevelMessagingStyle>
		<ccdyn:ConsumableLowUseAlgorithm>everyday3</ccdyn:ConsumableLowUseAlgorithm>
		<dd:ConsumablePercentageLevelRemaining>80</dd:ConsumablePercentageLevelRemaining>
		<dd:ConsumableReplaceabilityType>userReplaceable</dd:ConsumableReplaceabilityType>
		<dd:ConsumableStation>1</dd:ConsumableStation>
		<dd:ConsumableTypeEnum>inkCartridge</dd:ConsumableTypeEnum>
		<dd:RegionalCartridge>
			<dd:RegionIdentifier>21</dd:RegionIdentifier>
		</dd:RegionalCartridge>
		<dd:ConsumableIcon>
			<dd:Shape>Circle</dd:Shape>
			<dd:Rotation>rotateZero</dd:Rotation>
			<dd:FillColor>
				<dd:Red>0</dd:Red>
				<dd:Green>0</dd:Green>
				<dd:Blue>0</dd:Blue>
			</dd:FillColor>
			<dd:OutlineColor>
				<dd:Red>0</dd:Red>
				<dd:Green>0</dd:Green>
				<dd:Blue>0</dd:Blue>
			</dd:OutlineColor>
			<dd:BackGroundColor>
				<dd:Red>255</dd:Red>
				<dd:Green>255</dd:Green>
				<dd:Blue>255</dd:Blue>
			</dd:BackGroundColor>
		</dd:ConsumableIcon>
		<ccdyn:ConsumableUniqueID>00000000000000b0b49cf5782d39916e</ccdyn:ConsumableUniqueID>
	</ccdyn:ConsumableInfo>
</ccdyn:ConsumableConfigDyn>
